[
  { "id": "core.item.wood",    "kind": "item", "label": "wood",    "color": "#a07849", "stackLimit": 75, "sprite": "core.sprite.item.wood" },
  { "id": "core.item.stone",   "kind": "item", "label": "stone blocks", "color": "#9c968e", "stackLimit": 75, "sprite": "core.sprite.item.stone" },
  { "id": "core.item.steel",   "kind": "item", "label": "steel",   "color": "#a9b6bf", "stackLimit": 75, "sprite": "core.sprite.item.steel" },
  { "id": "core.item.berries", "kind": "item", "label": "berries", "color": "#b3304c", "stackLimit": 75, "nutrition": 50, "raw": true, "sprite": "core.sprite.item.berries" },
  { "id": "core.item.rice",    "kind": "item", "label": "rice",    "color": "#ece6cc", "stackLimit": 75, "nutrition": 50, "raw": true, "sprite": "core.sprite.item.rice" },
  { "id": "core.item.potato",  "kind": "item", "label": "potatoes", "color": "#c7a265", "stackLimit": 75, "nutrition": 50, "raw": true, "sprite": "core.sprite.item.potato" },
  { "id": "core.item.meat",    "kind": "item", "label": "raw meat", "color": "#b54a3c", "stackLimit": 75, "nutrition": 50, "raw": true, "meat": true, "sprite": "core.sprite.item.meat" },
  { "id": "core.item.meal",    "kind": "item", "label": "simple meal", "color": "#e3a43c", "stackLimit": 10, "nutrition": 900, "sprite": "core.sprite.item.meal" },
  { "id": "core.item.leather", "kind": "item", "label": "leather", "color": "#8a5a36", "stackLimit": 75, "sprite": "core.sprite.item.leather" },
  { "id": "core.item.cloth",   "kind": "item", "label": "cloth",   "color": "#d8d0bc", "stackLimit": 75, "sprite": "core.sprite.item.cloth" },
  { "id": "core.item.tunic",    "kind": "item", "label": "tunic",    "color": "#4f7cac", "stackLimit": 1, "slot": "torso", "cold": 3, "heat": 2,
    "recipe": { "station": "core.building.tailor_bench", "item": "core.item.cloth", "count": 25, "ticks": 500 }, "keep": 0,
    "sprite": "core.sprite.item.tunic", "layer": "core.sprite.wear.tunic", "portrait": "core.sprite.portrait.tunic" },
  { "id": "core.item.trousers", "kind": "item", "label": "trousers", "color": "#5a4a3a", "stackLimit": 1, "slot": "legs", "cold": 3, "heat": 1,
    "recipe": { "station": "core.building.tailor_bench", "item": "core.item.cloth", "count": 20, "ticks": 400 }, "keep": 0,
    "sprite": "core.sprite.item.trousers", "layer": "core.sprite.wear.trousers" },
  { "id": "core.item.tuque",    "kind": "item", "label": "tuque",    "color": "#b8423a", "stackLimit": 1, "slot": "head", "cold": 5, "heat": -2,
    "recipe": { "station": "core.building.tailor_bench", "item": "core.item.cloth", "count": 15, "ticks": 300 }, "keep": 0, "hidesHair": true,
    "sprite": "core.sprite.item.tuque", "layer": "core.sprite.wear.tuque", "portrait": "core.sprite.portrait.tuque" },
  { "id": "core.item.sun_hat",  "kind": "item", "label": "sun hat",  "color": "#d9b45a", "stackLimit": 1, "slot": "head", "cold": 0, "heat": 6,
    "recipe": { "station": "core.building.tailor_bench", "item": "core.item.cloth", "count": 15, "ticks": 300 }, "keep": 0,
    "sprite": "core.sprite.item.sun_hat", "layer": "core.sprite.wear.sun_hat", "portrait": "core.sprite.portrait.sun_hat" },
  { "id": "core.item.parka",    "kind": "item", "label": "parka",    "color": "#7d6a4e", "stackLimit": 1, "slot": "outer", "cold": 18, "heat": -4,
    "recipe": { "station": "core.building.tailor_bench", "item": "core.item.leather", "count": 50, "ticks": 900 }, "keep": 0,
    "sprite": "core.sprite.item.parka", "layer": "core.sprite.wear.parka", "portrait": "core.sprite.portrait.parka" },
  { "id": "core.item.leather_vest", "kind": "item", "label": "leather vest", "color": "#6b4329", "stackLimit": 1, "slot": "outer", "cold": 4, "heat": -1, "armor": 25,
    "recipe": { "station": "core.building.tailor_bench", "item": "core.item.leather", "count": 40, "ticks": 800 }, "keep": 0,
    "sprite": "core.sprite.item.leather_vest", "layer": "core.sprite.wear.leather_vest", "portrait": "core.sprite.portrait.leather_vest" }
]
